{"accepted_attempt_id":"known-answer-attempt","accepted_attempt_index":0,"arm_definition_sha256":"39933800c50a5ea70f6c5b53ae46f1dfac46dac6b4dd6d1a4125d3a9b594596f","arm_id":"known-answer-test-arm","arm_schema_version":1,"attestation_id":"c1f84739c98d1318eeaa84b30744b62c918557ace44bdac5d298597f3794dc25","attested_at":"2026-08-24T11:55:01.000Z","behavioral_evidence_types":["delegation-completed"],"behavioral_receipt_sha256":["7777777777777777777777777777777777777777777777777777777777777777"],"capability_receipt_sha256":["8888888888888888888888888888888888888888888888888888888888888888"],"context_id":"known-answer-context","executor_identity":"subprocess:external-producer-v1","expires_at":"2026-08-24T12:10:00.000Z","ledger_sha256":"6666666666666666666666666666666666666666666666666666666666666666","lifecycle":{"completed_children":1,"refusal_only":false,"status":"completed","successful_delegation":true},"nonce":"known-answer-nonce-0001","not_before":"2026-08-24T11:49:00.000Z","observation_completed_at":"2026-08-24T11:55:00.000Z","observation_started_at":"2026-08-24T11:50:00.000Z","producer_artifact_sha256":"5555555555555555555555555555555555555555555555555555555555555555","producer_commit":"3333333333333333333333333333333333333333","producer_repository":"https://github.com/example/external-producer","producer_tree":"4444444444444444444444444444444444444444","repetition_index":0,"result_file_sha256":"1111111111111111111111111111111111111111111111111111111111111111","result_id":"known-answer-result","result_path":"review/tests/results/future/known-answer/results.yaml","run_id":"known-answer-run","scenario_id":"A1","schema_version":1,"signature":"eOMAsYG+s6dHi/zvFiVHujxPvi1xdAhi1djFIzv2IUIAhKuGWW6ebfFmvTckKP7bzz8l5yGydPBWlLGEy6EGAw==","signing_key_fingerprint":"59778ce40a640b270449e28d68185fc4bf543814e9e01e90abb4b0aa86e61642","signing_key_id":"known-answer-test-key-1","signing_key_purpose":"test","task_id":"known-answer-task","workspace_id":"known-answer-workspace"}